[
  {
    "schema_version": 1,
    "normalization_version": "endpoint-v1",
    "normalized_event_id": "ep-ps-shadow-001",
    "raw_event_id": "ep-ps-shadow-001",
    "ts": "2026-05-15T09:10:00Z",
    "telemetry_type": "endpoint",
    "event_type": "process_start",
    "host": "workstation-ep01.corp.test",
    "user": "alice",
    "risk_score": 0.75,
    "event_source": "test-edr-agent",
    "trace_id": "shadow-trace-suspicious-001",
    "process": {
      "name": "powershell.exe",
      "pid": 6200,
      "ppid": 4892,
      "command_line": "powershell.exe -enc ZQBjAGgAbwAgACIAaABlAGwAbABvACIA",
      "path": "C:\\Windows\\System32\\WindowsPowerShell\\v1.0\\powershell.exe",
      "hash": "5891b5b522d5df086d0ff0b110fbd9d21bb4fc7163af34d08286a2e846f6be03"
    },
    "network": { "source_ip": null, "destination_ip": null, "destination_port": null, "protocol": null },
    "dns": { "domain": null, "resolved_ips": null },
    "file": { "path": null, "hash": null, "operation": null },
    "auth": { "action": null, "result": null }
  }
]
