[
  {
    "schema_version": 1,
    "normalization_version": "endpoint-v1",
    "normalized_event_id": "ep-c2-shadow-001",
    "raw_event_id": "ep-c2-shadow-001",
    "ts": "2026-05-15T10:10:00Z",
    "telemetry_type": "endpoint",
    "event_type": "network_connection",
    "host": "workstation-ep04.corp.test",
    "user": "alice",
    "risk_score": 0.72,
    "event_source": "endpoint-agent",
    "trace_id": "shadow-trace-c2-001",
    "process": { "name": "explorer.exe", "pid": 1200, "ppid": 4, "command_line": null, "path": null, "hash": null },
    "network": { "source_ip": "10.0.1.10", "destination_ip": "203.0.113.99", "destination_port": 4444, "protocol": "tcp" },
    "dns": { "domain": null, "resolved_ips": null },
    "file": { "path": null, "hash": null, "operation": null },
    "auth": { "action": null, "result": null }
  },
  {
    "schema_version": 1,
    "normalization_version": "endpoint-v1",
    "normalized_event_id": "ep-c2-shadow-002",
    "raw_event_id": "ep-c2-shadow-002",
    "ts": "2026-05-15T10:10:30Z",
    "telemetry_type": "endpoint",
    "event_type": "network_connection",
    "host": "workstation-ep04.corp.test",
    "user": "alice",
    "risk_score": 0.72,
    "event_source": "endpoint-agent",
    "trace_id": "shadow-trace-c2-001",
    "process": { "name": "explorer.exe", "pid": 1200, "ppid": 4, "command_line": null, "path": null, "hash": null },
    "network": { "source_ip": "10.0.1.10", "destination_ip": "203.0.113.99", "destination_port": 4444, "protocol": "tcp" },
    "dns": { "domain": null, "resolved_ips": null },
    "file": { "path": null, "hash": null, "operation": null },
    "auth": { "action": null, "result": null }
  },
  {
    "schema_version": 1,
    "normalization_version": "endpoint-v1",
    "normalized_event_id": "ep-c2-shadow-003",
    "raw_event_id": "ep-c2-shadow-003",
    "ts": "2026-05-15T10:11:00Z",
    "telemetry_type": "endpoint",
    "event_type": "network_connection",
    "host": "workstation-ep04.corp.test",
    "user": "alice",
    "risk_score": 0.72,
    "event_source": "endpoint-agent",
    "trace_id": "shadow-trace-c2-001",
    "process": { "name": "explorer.exe", "pid": 1200, "ppid": 4, "command_line": null, "path": null, "hash": null },
    "network": { "source_ip": "10.0.1.10", "destination_ip": "203.0.113.99", "destination_port": 4444, "protocol": "tcp" },
    "dns": { "domain": null, "resolved_ips": null },
    "file": { "path": null, "hash": null, "operation": null },
    "auth": { "action": null, "result": null }
  }
]
